{
  "schemaVersion": 1,
  "cliVersion": "4.13.1",
  "source": "shadcn",
  "registry": "@shadcn",
  "items": [
    {
      "name": "chart-area-axes",
      "type": "registry:block",
      "registry": "@shadcn",
      "addCommandArgument": "@shadcn/chart-area-axes"
    },
    {
      "name": "chart-area-default",
      "type": "registry:block",
      "registry": "@shadcn",
      "addCommandArgument": "@shadcn/chart-area-default"
    },
    {
      "name": "chart-area-gradient",
      "type": "registry:block",
      "registry": "@shadcn",
      "addCommandArgument": "@shadcn/chart-area-gradient"
    },
    {
      "name": "chart-area-icons",
      "type": "registry:block",
      "registry": "@shadcn",
      "addCommandArgument": "@shadcn/chart-area-icons"
    },
    {
      "name": "chart-area-interactive",
      "type": "registry:block",
      "registry": "@shadcn",
      "addCommandArgument": "@shadcn/chart-area-interactive"
    },
    {
      "name": "chart-area-legend",
      "type": "registry:block",
      "registry": "@shadcn",
      "addCommandArgument": "@shadcn/chart-area-legend"
    },
    {
      "name": "chart-area-linear",
      "type": "registry:block",
      "registry": "@shadcn",
      "addCommandArgument": "@shadcn/chart-area-linear"
    },
    {
      "name": "chart-area-stacked",
      "type": "registry:block",
      "registry": "@shadcn",
      "addCommandArgument": "@shadcn/chart-area-stacked"
    },
    {
      "name": "chart-area-stacked-expand",
      "type": "registry:block",
      "registry": "@shadcn",
      "addCommandArgument": "@shadcn/chart-area-stacked-expand"
    },
    {
      "name": "chart-area-step",
      "type": "registry:block",
      "registry": "@shadcn",
      "addCommandArgument": "@shadcn/chart-area-step"
    },
    {
      "name": "chart-bar-active",
      "type": "registry:block",
      "registry": "@shadcn",
      "addCommandArgument": "@shadcn/chart-bar-active"
    },
    {
      "name": "chart-bar-default",
      "type": "registry:block",
      "registry": "@shadcn",
      "addCommandArgument": "@shadcn/chart-bar-default"
    },
    {
      "name": "chart-bar-horizontal",
      "type": "registry:block",
      "registry": "@shadcn",
      "addCommandArgument": "@shadcn/chart-bar-horizontal"
    },
    {
      "name": "chart-bar-interactive",
      "type": "registry:block",
      "registry": "@shadcn",
      "addCommandArgument": "@shadcn/chart-bar-interactive"
    },
    {
      "name": "chart-bar-label",
      "type": "registry:block",
      "registry": "@shadcn",
      "addCommandArgument": "@shadcn/chart-bar-label"
    },
    {
      "name": "chart-bar-label-custom",
      "type": "registry:block",
      "registry": "@shadcn",
      "addCommandArgument": "@shadcn/chart-bar-label-custom"
    },
    {
      "name": "chart-bar-mixed",
      "type": "registry:block",
      "registry": "@shadcn",
      "addCommandArgument": "@shadcn/chart-bar-mixed"
    },
    {
      "name": "chart-bar-multiple",
      "type": "registry:block",
      "registry": "@shadcn",
      "addCommandArgument": "@shadcn/chart-bar-multiple"
    },
    {
      "name": "chart-bar-negative",
      "type": "registry:block",
      "registry": "@shadcn",
      "addCommandArgument": "@shadcn/chart-bar-negative"
    },
    {
      "name": "chart-bar-stacked",
      "type": "registry:block",
      "registry": "@shadcn",
      "addCommandArgument": "@shadcn/chart-bar-stacked"
    },
    {
      "name": "chart-line-default",
      "type": "registry:block",
      "registry": "@shadcn",
      "addCommandArgument": "@shadcn/chart-line-default"
    },
    {
      "name": "chart-line-dots",
      "type": "registry:block",
      "registry": "@shadcn",
      "addCommandArgument": "@shadcn/chart-line-dots"
    },
    {
      "name": "chart-line-dots-colors",
      "type": "registry:block",
      "registry": "@shadcn",
      "addCommandArgument": "@shadcn/chart-line-dots-colors"
    },
    {
      "name": "chart-line-dots-custom",
      "type": "registry:block",
      "registry": "@shadcn",
      "addCommandArgument": "@shadcn/chart-line-dots-custom"
    },
    {
      "name": "chart-line-interactive",
      "type": "registry:block",
      "registry": "@shadcn",
      "addCommandArgument": "@shadcn/chart-line-interactive"
    },
    {
      "name": "chart-line-label",
      "type": "registry:block",
      "registry": "@shadcn",
      "addCommandArgument": "@shadcn/chart-line-label"
    },
    {
      "name": "chart-line-label-custom",
      "type": "registry:block",
      "registry": "@shadcn",
      "addCommandArgument": "@shadcn/chart-line-label-custom"
    },
    {
      "name": "chart-line-linear",
      "type": "registry:block",
      "registry": "@shadcn",
      "addCommandArgument": "@shadcn/chart-line-linear"
    },
    {
      "name": "chart-line-multiple",
      "type": "registry:block",
      "registry": "@shadcn",
      "addCommandArgument": "@shadcn/chart-line-multiple"
    },
    {
      "name": "chart-line-step",
      "type": "registry:block",
      "registry": "@shadcn",
      "addCommandArgument": "@shadcn/chart-line-step"
    },
    {
      "name": "chart-pie-donut",
      "type": "registry:block",
      "registry": "@shadcn",
      "addCommandArgument": "@shadcn/chart-pie-donut"
    },
    {
      "name": "chart-pie-donut-active",
      "type": "registry:block",
      "registry": "@shadcn",
      "addCommandArgument": "@shadcn/chart-pie-donut-active"
    },
    {
      "name": "chart-pie-donut-text",
      "type": "registry:block",
      "registry": "@shadcn",
      "addCommandArgument": "@shadcn/chart-pie-donut-text"
    },
    {
      "name": "chart-pie-interactive",
      "type": "registry:block",
      "registry": "@shadcn",
      "addCommandArgument": "@shadcn/chart-pie-interactive"
    },
    {
      "name": "chart-pie-label",
      "type": "registry:block",
      "registry": "@shadcn",
      "addCommandArgument": "@shadcn/chart-pie-label"
    },
    {
      "name": "chart-pie-label-custom",
      "type": "registry:block",
      "registry": "@shadcn",
      "addCommandArgument": "@shadcn/chart-pie-label-custom"
    },
    {
      "name": "chart-pie-label-list",
      "type": "registry:block",
      "registry": "@shadcn",
      "addCommandArgument": "@shadcn/chart-pie-label-list"
    },
    {
      "name": "chart-pie-legend",
      "type": "registry:block",
      "registry": "@shadcn",
      "addCommandArgument": "@shadcn/chart-pie-legend"
    },
    {
      "name": "chart-pie-separator-none",
      "type": "registry:block",
      "registry": "@shadcn",
      "addCommandArgument": "@shadcn/chart-pie-separator-none"
    },
    {
      "name": "chart-pie-simple",
      "type": "registry:block",
      "registry": "@shadcn",
      "addCommandArgument": "@shadcn/chart-pie-simple"
    },
    {
      "name": "chart-pie-stacked",
      "type": "registry:block",
      "registry": "@shadcn",
      "addCommandArgument": "@shadcn/chart-pie-stacked"
    },
    {
      "name": "chart-radar-default",
      "type": "registry:block",
      "registry": "@shadcn",
      "addCommandArgument": "@shadcn/chart-radar-default"
    },
    {
      "name": "chart-radar-dots",
      "type": "registry:block",
      "registry": "@shadcn",
      "addCommandArgument": "@shadcn/chart-radar-dots"
    },
    {
      "name": "chart-radar-grid-circle",
      "type": "registry:block",
      "registry": "@shadcn",
      "addCommandArgument": "@shadcn/chart-radar-grid-circle"
    },
    {
      "name": "chart-radar-grid-circle-fill",
      "type": "registry:block",
      "registry": "@shadcn",
      "addCommandArgument": "@shadcn/chart-radar-grid-circle-fill"
    },
    {
      "name": "chart-radar-grid-circle-no-lines",
      "type": "registry:block",
      "registry": "@shadcn",
      "addCommandArgument": "@shadcn/chart-radar-grid-circle-no-lines"
    },
    {
      "name": "chart-radar-grid-custom",
      "type": "registry:block",
      "registry": "@shadcn",
      "addCommandArgument": "@shadcn/chart-radar-grid-custom"
    },
    {
      "name": "chart-radar-grid-fill",
      "type": "registry:block",
      "registry": "@shadcn",
      "addCommandArgument": "@shadcn/chart-radar-grid-fill"
    },
    {
      "name": "chart-radar-grid-none",
      "type": "registry:block",
      "registry": "@shadcn",
      "addCommandArgument": "@shadcn/chart-radar-grid-none"
    },
    {
      "name": "chart-radar-icons",
      "type": "registry:block",
      "registry": "@shadcn",
      "addCommandArgument": "@shadcn/chart-radar-icons"
    },
    {
      "name": "chart-radar-label-custom",
      "type": "registry:block",
      "registry": "@shadcn",
      "addCommandArgument": "@shadcn/chart-radar-label-custom"
    },
    {
      "name": "chart-radar-legend",
      "type": "registry:block",
      "registry": "@shadcn",
      "addCommandArgument": "@shadcn/chart-radar-legend"
    },
    {
      "name": "chart-radar-lines-only",
      "type": "registry:block",
      "registry": "@shadcn",
      "addCommandArgument": "@shadcn/chart-radar-lines-only"
    },
    {
      "name": "chart-radar-multiple",
      "type": "registry:block",
      "registry": "@shadcn",
      "addCommandArgument": "@shadcn/chart-radar-multiple"
    },
    {
      "name": "chart-radar-radius",
      "type": "registry:block",
      "registry": "@shadcn",
      "addCommandArgument": "@shadcn/chart-radar-radius"
    },
    {
      "name": "chart-radial-grid",
      "type": "registry:block",
      "registry": "@shadcn",
      "addCommandArgument": "@shadcn/chart-radial-grid"
    },
    {
      "name": "chart-radial-label",
      "type": "registry:block",
      "registry": "@shadcn",
      "addCommandArgument": "@shadcn/chart-radial-label"
    },
    {
      "name": "chart-radial-shape",
      "type": "registry:block",
      "registry": "@shadcn",
      "addCommandArgument": "@shadcn/chart-radial-shape"
    },
    {
      "name": "chart-radial-simple",